{
  "schema_version": "1.0.0",
  "lane": "LWF_NOTE_NETWORK_LOCAL_ORCHESTRATOR",
  "project_priority": "LOCAL_LWF_NOTE_NETWORK_FIRST",
  "public_version_deferred": true,
  "local_orchestrator_priority": true,
  "scout_phase": {
    "chatgpt_writes_plan": true,
    "owner_writes_plan_to_input": "C:\\LWF_NoteNetwork\\inputs\\scout_plan.txt",
    "local_runner": "run-scout.ps1",
    "all_note_nodes_required": true,
    "completed": true,
    "chatgpt_review_required": true,
    "codex_execution_approved_by_scout": false
  },
  "note_nodes": ["NOTE-01", "NOTE-02", "NOTE-03", "NOTE-04", "NOTE-05"],
  "node_roles": {
    "NOTE-01": "scope reader and task-boundary checker",
    "NOTE-02": "contradiction and missing-evidence detector",
    "NOTE-03": "fixture and schema coverage scout",
    "NOTE-04": "safety-boundary reminder",
    "NOTE-05": "compact packet reviewer and owner-decision reducer"
  },
  "merged_packet": {
    "created": true,
    "includes_all_note_nodes": true,
    "treated_as_proof": false
  },
  "compact_packet": {
    "created": true,
    "given_to_chatgpt": true,
    "requires_independent_verification": true
  },
  "codex_phase": {
    "bounded_prompt_required": true,
    "scout_completed": true,
    "chatgpt_scout_review_completed": false,
    "execution_allowed": false,
    "artifact_zip_required": true,
    "sha_sidecars_required": true,
    "cloud_unpushed_worktree_assumed_readable": false
  },
  "codex_usage_reduction": {
    "note_preprocessing_enabled": true,
    "codex_scope_reduced_by_scout": true,
    "codex_final_authority": false
  },
  "review_phase": {
    "required_after_codex_execution": true,
    "completed": false,
    "all_note_nodes_required": true,
    "push_approved_by_review": false
  },
  "chatgpt_final_review": {
    "required": true,
    "uses_artifacts": true,
    "uses_diffs": true,
    "uses_tests": true,
    "uses_manifests": true,
    "uses_repo_evidence": true,
    "note_output_is_proof": false
  },
  "owner_decision": {
    "required": true,
    "one_point_only": true,
    "ready_is_go": false,
    "matched_is_go": false
  },
  "safety_boundary": {
    "runtime_go": false,
    "push_go": false,
    "deploy_go": false,
    "public_submission_go": false,
    "note_output_is_local_preprocessing": true,
    "owner_review_mandatory": true
  },
  "forbidden_actions": {
    "runtime_automation": false,
    "openai_api_call": false,
    "private_api_call": false,
    "local_note_node_call": false,
    "ollama_call": false,
    "queue_mutation": false,
    "cloud_mutation": false,
    "billing_mutation": false,
    "auth_mutation": false,
    "trading_mutation": false,
    "push": false,
    "pr": false,
    "merge": false,
    "deploy": false,
    "public_submission": false
  },
  "evidence_requirements": {
    "artifact_zip": true,
    "sha_sidecars": true,
    "diffs": true,
    "test_summary": true,
    "manifest": true,
    "repo_evidence": true,
    "note_output_alone_sufficient": false
  },
  "terminal_state": "READY_FOR_CHATGPT_SCOUT_REVIEW"
}
